{
  "id": "abe6bad7-3b30-3f1c-dee5-f653ded15636",
  "itemBarcode": "553285216744",
  "createdDateTime": "2021-02-19T17:27:38.524736500",
  "accessionedDateTime": "2021-02-19T17:29:38.524736500",
  "remoteStorageId": "d3cfdb9e-e364-4209-85e5-8f49fc0969b5",
  "callNumber": "1234567890",
  "instanceTitle": "Title sample",
  "instanceAuthor": "Matt Gordon "
}
